,Term,fdr,es,nes
0,mitotic spindle organization (GO:0007052),0.002821059537477448,0.5430293619243464,1.6434379787807742
1,chromosome organization (GO:0051276),0.003291236127057023,0.6607308909152112,1.7397985757929908
2,mitotic nuclear division (GO:0140014),0.003291236127057023,0.6205213780106453,1.674890449406814
3,generation of neurons (GO:0048699),0.003949483352468427,0.6526110192663007,1.6999754276986634
4,microtubule cytoskeleton organization involved in mitosis (GO:1902850),0.0049368541905855335,0.5690246785899304,1.7131634989715365
5,mitotic sister chromatid segregation (GO:0000070),0.0049368541905855335,0.6360340323600614,1.7944789643257346
6,modification-dependent protein catabolic process (GO:0019941),0.009873708381171067,0.6982818731516761,1.8097873237214028
7,cellular response to oxygen-containing compound (GO:1901701),0.01727898966704937,0.6048624942810998,1.5685412675718884
8,cellular response to growth factor stimulus (GO:0071363),0.04739380022962112,0.5804431758611542,1.5052418815215096
